{
  "project_id": "example_mirrorworld",
  "global_status": "designing",
  "visual_locked": true,
  "review_iteration": 0,
  "output_mode": "pptx+html",
  "production_sub_mode": "standard_deck",
  "pages": [
    { "page_id": "slide_01", "role": "hero_cover", "status": "ready", "qa_status": "passed", "qa_reason": "", "visual_status": "locked", "rollback_stage": "", "rollback_owner": "", "rollback_targets": [], "rollback_reason": "", "rollback_routes": [], "content_hash": "demo_01", "css_components_used": ["glass-panel", "flow-node"] },
    { "page_id": "slide_02", "role": "hero_value", "status": "ready", "qa_status": "passed", "qa_reason": "", "visual_status": "locked", "rollback_stage": "", "rollback_owner": "", "rollback_targets": [], "rollback_reason": "", "rollback_routes": [], "content_hash": "demo_02", "css_components_used": ["glass-panel", "diagnosis-card"] },
    { "page_id": "slide_03", "role": "hero_problem", "status": "building", "qa_status": "pending", "qa_reason": "", "visual_status": "locked", "rollback_stage": "", "rollback_owner": "", "rollback_targets": [], "rollback_reason": "", "rollback_routes": [], "content_hash": "", "css_components_used": [] },
    { "page_id": "slide_04", "role": "hero_value", "status": "awaiting_visual_lock", "qa_status": "pending", "qa_reason": "", "visual_status": "pending", "rollback_stage": "", "rollback_owner": "", "rollback_targets": [], "rollback_reason": "", "rollback_routes": [], "content_hash": "", "css_components_used": [] },
    { "page_id": "slide_05", "role": "hero_proof", "status": "pending", "qa_status": "pending", "qa_reason": "", "visual_status": "pending", "rollback_stage": "", "rollback_owner": "", "rollback_targets": [], "rollback_reason": "", "rollback_routes": [], "content_hash": "", "css_components_used": [] },
    { "page_id": "slide_06", "role": "hero_system", "status": "pending", "qa_status": "pending", "qa_reason": "", "visual_status": "pending", "rollback_stage": "", "rollback_owner": "", "rollback_targets": [], "rollback_reason": "", "rollback_routes": [], "content_hash": "", "css_components_used": [] },
    { "page_id": "slide_07", "role": "hero_diff", "status": "pending", "qa_status": "pending", "qa_reason": "", "visual_status": "pending", "rollback_stage": "", "rollback_owner": "", "rollback_targets": [], "rollback_reason": "", "rollback_routes": [], "content_hash": "", "css_components_used": [] },
    { "page_id": "slide_08", "role": "hero_value", "status": "pending", "qa_status": "pending", "qa_reason": "", "visual_status": "pending", "rollback_stage": "", "rollback_owner": "", "rollback_targets": [], "rollback_reason": "", "rollback_routes": [], "content_hash": "", "css_components_used": [] },
    { "page_id": "slide_09", "role": "hero_value", "status": "pending", "qa_status": "pending", "qa_reason": "", "visual_status": "pending", "rollback_stage": "", "rollback_owner": "", "rollback_targets": [], "rollback_reason": "", "rollback_routes": [], "content_hash": "", "css_components_used": [] },
    { "page_id": "slide_10", "role": "hero_cta", "status": "pending", "qa_status": "pending", "qa_reason": "", "visual_status": "pending", "rollback_stage": "", "rollback_owner": "", "rollback_targets": [], "rollback_reason": "", "rollback_routes": [], "content_hash": "", "css_components_used": [] }
  ]
}
